name,year,runtime,agerating,summary,userrating,noofusers,metascore,director,star1,star2,star3
"Food, Inc.",2008,1h 34m,PG,An unflattering look inside America's corporate controlled food industry.,7.8,"51,989",80,Robert Kenner,Michael Pollan,Eric Schlosser,Richard Lobb
Before the Flood,2016,1h 36m,PG,"A look at how climate change affects our environment and what society can do to prevent the demise of endangered species, ecosystems and native communities across the planet.",8.2,"28,682",63,Fisher Stevens,Leonardo DiCaprio,Ban Ki-moon,Alejandro G. Iñárritu
Born Into Brothels: Calcutta's Red Light Kids,2004,1h 25m,R,"Two documentary filmmakers chronicle their time in Sonagchi, Calcutta and the relationships they developed with children of prostitutes who work the city's notorious red light district.",7.2,"17,853",78,Zana Briski,Kochi,Avijit Halder,Shanti Das
Requiem for the American Dream,2015,1h 13m,Not Rated,Renowned academic and author Noam Chomsky elucidates 10 principles of concentration of wealth and power that have led to unprecedented inequality and the hollowing out of the American middle class.,8.1,"9,825",,Peter D. Hutchison,Noam Chomsky,Alan Greenspan,Malcolm X
The Square,2013,1h 35m,Not Rated,"A group of Egyptian revolutionaries battle leaders and regimes, risking their lives to build a new society of conscience.",8.0,"9,328",84,Jehane Noujaim,Ahmed Hassan,Khalid Abdalla,Magdy Ashour
Racing Extinction,2015,1h 30m,Not Rated,A documentary that follows undercover activists trying to stave off a man-made mass extinction.,8.2,"8,147",81,Louie Psihoyos,Elon Musk,Joel Sartore,Louie Psihoyos
The True Cost,2015,1h 32m,PG-13,The True Cost is a documentary film exploring the impact of fashion on people and the planet.,7.7,"7,249",46,Andrew Morgan,Livia Giuggioli,Stella McCartney,Vandana Shiva
Terms and Conditions May Apply,2013,1h 19m,Not Rated,"A documentary that exposes what corporations and governments learn about people through Internet and cell phone usage, and what can be done about it ... if anything.",7.3,"6,519",68,Cullen Hoback,Max Schrems,Moby,Mark Zuckerberg
The Age of Stupid,2009,1h 32m,Not Rated,A future archivist looks at old footage from the year 2008 to understand why humankind failed to address climate change.,7.0,"4,670",,Franny Armstrong,Pete Postlethwaite,Jehangir Wadia,Alvin DuVernay
The Weight of Chains,2010,2h 5m,Not Rated,"The Weight of Chains is a Canadian documentary film that takes a critical look at the role that the US, NATO and the EU played in the tragic breakup of a once peaceful and prosperous European state - Yugoslavia. The film, bursting with rare stock footage never before seen by Western audiences, is a creative first-hand look at why the West intervened in the Yugoslav conflict, with an impressive roster of interviews with academics, diplomats, media personalities and ordinary citizens of the former Yugoslav republics. This film also presents positive stories from the Yugoslav wars - people helping each other regardless of their ethnic background, stories of bravery and self-sacrifice.",8.1,"4,514",,Boris Malagurski,Rade Aleksic,James Bissett,John Bosnitch
How to Survive a Plague,2012,1h 50m,Not Rated,The story of two coalitions -- ACT UP and TAG (Treatment Action Group) -- whose activism and innovation turned AIDS from a death sentence into a manageable condition.,7.6,"4,320",86,David France,Peter Staley,Larry Kramer,Iris Long
Korengal,2014,1h 24m,R,"Korengal picks up where Restrepo (2010) left off--with the same men, in the same valley, with the same commanders--but presents a very different look at the experience of war.",6.7,"4,070",67,Sebastian Junger,LaMonta Caldwell,Miguel Cortez,Stephen Gillespie
The Culture High,2014,2h,TV-14,Scours the deep-seated roots of this morally induced Marijuana campaign and reveal the fascinating path it has taken to get to where it is today.,8.2,"3,737",37,Brett Harvey,Joe Rogan,Snoop Dogg,Ronald Reagan
Banking on Bitcoin,2016,1h 30m,TV-PG,"Bitcoin is the most disruptive invention since the Internet, and now an ideological battle is underway between fringe utopists and mainstream capitalism. The film shows the players who are defining how this technology will shape our lives.",6.6,"3,724",,Christopher Cannucciari,Charlie Shrem,Nancy Cannucciari,Paul Vigna
Alive Inside: A Story of Music and Memory,2014,1h 18m,Not Rated,"Dan Cohen, founder of the nonprofit organization Music & Memory, fights against a broken healthcare system to demonstrate music's ability to combat memory loss and restore a deep sense of self to those suffering from it.",8.2,"3,216",67,Michael Rossato-Bennett,Dan Cohen,Louise Dueno,Nell Hardie
Cameraperson,2016,1h 42m,Not Rated,"Exposing her role behind the camera, Kirsten Johnson reaches into the vast trove of footage she has shot over decades around the world. What emerges is a visually bold memoir and a revelatory interrogation of the power of the camera.",7.4,"3,147",89,Kirsten Johnson,Kirsten Johnson,Aisha Bukar,Eric W. Davis
Four Horsemen,2012,1h 37m,Not Rated,"The modern day Four Horsemen continue to ride roughshod over the people who can least afford it. Crises are converging when governments, religion and mainstream economists have stalled. 23 international thinkers come together and break their silence about how the world really works and why there is still hope in re-establishing a moral and just society. Four Horsemen is free from mainstream media propaganda, doesn't bash bankers, criticize politicians or get involved in conspiracy theories. The film ignites the debate about how we usher a new economic paradigm into the world which, globally, would dramatically improve the quality of life for billions.",7.7,"2,911",,Ross Ashcroft,Dominic Frisby,Gillian Tett,Lawrence Wilkerson
I Want to Live,2015,1h 46m,6.3,"Stories of Kurdish Refugees from Syria who are living in refugee camps in Kurdistan. The film was shot on location and takes place during the Syrian civil war and the ISIS attacks on Kurdistan. The story is told through the eyes of a young boy named Shndar, who has Thalassemia disease. He searches for immediate treatment while living as a refugee, leaving his home due to ethnic and religious hatred. The film depicts daily life within and outside of the refugee camp. A character study that explores themes of life, death, war, peace, and tolerance.", (2.9K),"2,872",,Karzan Kardozi,Shndar Noradin Ali,Ahmed Noradin Ali,Noradin Khalaf Ali
The Mask You Live In,2015,1h 37m,Not Rated,"Explores how our culture's narrow definition of masculinity is harming our boys, men and society at large and unveils what we can do about it.",7.6,"2,783",,Jennifer Siebel Newsom,Joe Herman,Michael Kimmel,Caroline Heldman
No Safe Spaces,2019,1h 40m,PG-13,No Safe Spaces contends that identity politics and the suppression of free speech are spreading into every part of society and threatening to divide America.,7.2,"2,687",31,Justin Folk,Adam Carolla,Dennis Prager,Jordan B. Peterson
